review_index,score,content_preview,detected_problems,keywords_found,problem_count
1134,5,"aplikasi ini bantu aku banget buat tau info lowongan pekerjaan, jadi memudahkan banget kalau mau nya...",['No_Problem_Detected'],[],0
1135,5,"bintang 5 buat siapkerja by kemnaker, fitur nya banyak bgt, buat fresh graduate bisa bgt mau persiap...",['No_Problem_Detected'],[],0
1136,5,rekomendasi buat para pencaker. karena aplikasinya memudahkan sekali untuk mencari pekerjaan. fitur ...,['No_Problem_Detected'],[],0
1137,5,terima kasih siap kerja. berkat aplikasi ini aku bisa mencari lowongan pekerjaan sesuai dengan basic...,['No_Problem_Detected'],[],0
1138,5,aplikasi siapkerja ini bener bener membantu banget bagi aku yang lagi cari kerja dan lama belum dape...,['No_Problem_Detected'],[],0
1139,5,"applikasinya sangat membantu sekali, terimakasih siap kerja memudahkan saya mencari info lowongan pe...",['No_Problem_Detected'],[],0
1140,5,"makasih siapkerjaa, didalem appsnya nih banyak macem pelatihan mana banyak yang gratis pula jadi keb...",['No_Problem_Detected'],[],0
1141,5,"aplikasi siapkerja sangat bagus, apalagi banyak fitur-fitur yang menurut aku sangat membantu bagi ak...",['No_Problem_Detected'],[],0
1142,5,"makasih banget buat aplikasi siapkerja ini, membantu banget untuk aku yang belum punya kerjaan karna...",['No_Problem_Detected'],[],0
1143,5,"aplikasinya bagus karena banyak pelatihan buat peningkatan kompetensi, job opprtunity, dan lowongan ...",['No_Problem_Detected'],[],0
1144,5,"aplikasi ini bagus banget, sangat membantu aku yg belum dapet kerja dan lagi cari info lowongan. fit...",['No_Problem_Detected'],[],0
1145,5,tampilan aplikasinya menarik dan isi dari aplikasinya sangat membantu bagi para pencari kerja dan ba...,['No_Problem_Detected'],[],0
1146,5,"aplikasinya sangat mempermudah, mulai dari aktivasi hingga fitur-fitur didalamnyaa, tidak hanya untu...",['No_Problem_Detected'],[],0
1147,5,"aplikasi yang sangat membantuu karena meberikan info seputar pelatihan, lowongan kerja dll. selain i...",['No_Problem_Detected'],[],0
1148,5,aplikasi nya sangat membantu untuk mencari pekerjaan. fitur lengkap dan user friendly. pertahankan t...,['No_Problem_Detected'],[],0
1149,5,tampilannya mudah dimengerti. aplikasinya sangat membantu terutama untuk informasi lowongan pekerjaa...,['No_Problem_Detected'],[],0
1150,5,"saya kehilangan sim card ,dan saya mendaftar untuk pembuatan id recom menggunakan nomor tersebut,leb...",['No_Problem_Detected'],[],0
1151,5,"aplikasikasih ini, sangat bermanfaat bagi para kerja, karna aplikasi ini menyediakan program pelatih...",['No_Problem_Detected'],[],0
1152,5,"terimakasih atas lowongannya, sangat memudahkan banget aplikasi siap kerja ini..semenjak ada aplikas...",['No_Problem_Detected'],[],0
1153,5,aplikasinya bagus banget loh. beneran membantu banget bagi orang yang lagi mencari pekerjaan. terus ...,['No_Problem_Detected'],[],0
1154,5,"aplikasinya sangat bagus, cocok untuk orang yang sedang mencari pekerjaan. terdapat fitur-fitur dan ...",['No_Problem_Detected'],[],0
1155,5,"aplikasinya sangat membantu sekali untuk mencari lowongan pekerjaan, terimakasih siap kerja, berkat ...",['No_Problem_Detected'],[],0
1156,5,"aplikasi nya sangat bagus sekali karena berisi banyak informasi terkait lowongan pekerjaan, fiturnya...",['No_Problem_Detected'],[],0
1157,5,"terima kasih banyak, aplikasi ini sangat bermanfaat dan membantu sekali bagi saya yang mencari lowon...",['No_Problem_Detected'],[],0
1158,5,"aplikasinya baguss banget, sangat membantu untuk saya yang sedang mencari pekerjaan, banyak informas...",['No_Problem_Detected'],[],0
1159,5,semudah ini kita bisa nyari perkerjaan hanya di aplikasi siapkerja. banyak macam macam jenis kerjaan...,['No_Problem_Detected'],[],0
1160,5,"aplikasi ini sangat membantu bagi para pencari kerja, ada informasi lowongan pekerjaan dan juga pela...",['No_Problem_Detected'],[],0
1161,5,aplikasinya sangat membantu karna memberi layanan yang bermanfaat tentunya dan banyak lowongan kerja...,['No_Problem_Detected'],[],0
1162,5,"aplikasi nya bagus tapi kalo mencet pusat bantuan langsung diarahkan ke web, dan web tersebut sering...",['No_Problem_Detected'],[],0
1163,5,"sangat berterimakasih sama aplikasi siapkerja soalnya sangat ngebantu aku yg blum punya kerjaan, inf...",['No_Problem_Detected'],[],0
1164,5,"aplikasi mantep banget soalnya fitur fiturnya keren jadi membantu saya mencari kerja, terus fitur pe...",['No_Problem_Detected'],[],0
1165,5,sejak ada aplikasi ini nyari lowongan kerja ga usah keluar rumah ngabisin ongkos atau bensin. cukup ...,['No_Problem_Detected'],[],0
1166,5,"aplikasi yg memudahkan kita menemukan pekerjaan yg cocok dg skill kita, ada pelatihan kerja nya juga...",['No_Problem_Detected'],[],0
1167,5,aplikasinya bagus sangat membantu untuk yang sedang mencari pekerjaan termasuk aku yang belum punya ...,['No_Problem_Detected'],[],0
1168,5,"ini kenapa klaim ke-6 statusnya masih tahap ""sedang mempersiapkan berkas"" ??? nyoba ""hubungi contact...",['No_Problem_Detected'],[],0
1169,5,"aplikasi yang dikemas secara rapi dan sempurna, fitur fitur dalam desain yang elegant membuat semang...",['No_Problem_Detected'],[],0
1170,5,"aplikasi yang sangat bagus dan bermanfaat, tampilannya juga tidak membosankan. semoga kedepannya apl...",['No_Problem_Detected'],[],0
1171,5,"terimakasih siap kerja, sangat membantu saya yang kebetulan susah mencari kerjaan. fitur-fiturnya ju...",['No_Problem_Detected'],[],0
1172,5,"terdebest lah, apk siap kerja sangat membantu mencari info loker plus mudah dipahami apknya, gaada k...",['No_Problem_Detected'],[],0
1173,5,"app nya bagus ,memudahkan aku untuk mencari kerjaan ada pelatihan nya juga bener2 ngabantu aku,terim...",['No_Problem_Detected'],[],0
1174,5,"sangat memudahkan untuk mencari info lowongan kerja, selain itu juga aplikasinya mudah dimengerti. t...",['No_Problem_Detected'],[],0
1175,5,"sudah cukup baik, tinggal diperbaiki perihal karirhub nya agar tidak perlu diarahkan kembali ke goog...",['No_Problem_Detected'],[],0
1176,5,"aplikasi bermanfaat! sangat membantu saya untuk mencari pekerjaan, mengikuti ikut pelatihan, dan ber...",['No_Problem_Detected'],[],0
1177,5,"sangat membantu dalam memberikan penjelasan dan info buat pencari pekerjaan , trimah kasih",['No_Problem_Detected'],[],0
1178,5,aplikasi siap kerja ini bermanfaat terutama bagi yang belum punya pekerjaan karena di aplikasi ini s...,['No_Problem_Detected'],[],0
1179,5,"berkat aplikasi siapkerja, sekarang udah dapet kerjaan. membantu banget. terimakasih untuk penyediaa...",['No_Problem_Detected'],[],0
1180,5,"dengan adanya aplikasi ini saya jadi lebih mudah untuk mencari lapangan pekerjaan, makasih siap kerj...",['No_Problem_Detected'],[],0
1181,5,"sebagai jobseeker dan fresh grad, aplikasi ini ngebantu banget buat cari pekerjaan:') memudahkan ban...",['No_Problem_Detected'],[],0
1182,5,"aplikasi nya membantu orang-orang untuk mencari pekerjaan, banyak lowongan yang tersedia dipajang da...",['No_Problem_Detected'],[],0
1183,5,"thanks mimin, aplikasinya berguna banget untuk aku yang belum punya pekerjaan. jadi aku gampang tau ...",['No_Problem_Detected'],[],0
1184,5,aplikasi ini sangat membantu buat para jobseeker. fitur-fitur yg disediakan juga cukup lengkap dan m...,['No_Problem_Detected'],[],0
1185,5,"makasih siap kerja, info lowongam kerjanya lengkap banget. fitur-fitur di aplikasinya juga mudah dip...",['No_Problem_Detected'],[],0
1186,5,"aplikasinya sangat membantu banget buat aku yang saat ini belum punya pekerjaan , info lowongan yang...",['No_Problem_Detected'],[],0
1187,5,"aplikasinya bagus, banyak pelatihan buat meningkatkan skill bekerja dan lowongan pekerjaan.",['No_Problem_Detected'],[],0
1188,5,"aplikasinya mudah banget dipahami, cocok untuk mencari pekerjaan. terimakasih siapkerja sangat memba...",['No_Problem_Detected'],[],0
1189,5,"aplikasi ini sangat bermanfaat bagi para pekerja, karena aplikasi ini menyediakan program pelatihan ...",['No_Problem_Detected'],[],0
1190,5,"ini aplikasi siapkerja benar-benar sangat bermanfaat buat yang lagi butuh kerja, banyak informasi ya...",['No_Problem_Detected'],[],0
1191,5,terimakasih banyak aplikasi ini sangat membantu sekali dalam mencari pekerjaan. banyak sekali lowong...,['No_Problem_Detected'],[],0
1192,5,"aplikasi ini sangat membantu untuk mencari informasi perkerjaan dengan cepat, apalagi dengan fitur-f...",['No_Problem_Detected'],[],0
1193,5,"ngebantu banget untuk aku yang belum punya pekerjaan , appnya memberikan info pelatihan dan menyedia...",['No_Problem_Detected'],[],0
1194,5,"aplikasi sangat membantu untuk mempermudah mencari informasi terkait lowongan kerja, fitur""nya juga ...",['No_Problem_Detected'],[],0
1195,5,"terima kasih info lowongan kerjanya, berkat aplikasi ini saya jadi mudah untuk mencari lowongan kerj...",['No_Problem_Detected'],[],0
1196,5,aplikasinya sangat bagus buat aku yang baru lulus dan butuh banget pekerjaan. apknya sangat membantu...,['No_Problem_Detected'],[],0
1197,5,terobosan baru. membantu banget bagi pencari kerja atau yg memerlukan tambahan ketrampilan supaya bi...,['No_Problem_Detected'],[],0
1198,5,aplikasi ini memudahkan saya dalam mencari perkerjaan dan info lowongan kerjanya juga banyak. terima...,['No_Problem_Detected'],[],0
1199,5,aplikasi nya sangat bagus dan mudah dipahami. banyak fitur yang bisa membantu. pokonya terimakasih s...,['No_Problem_Detected'],[],0
1200,5,"aplikasinya sangat membantu buat orang-orang yang lagi cari/butuh pekerjaan, soalnya banyak info soa...",['No_Problem_Detected'],[],0
1201,5,"menurut saya, aplikasi siapkerja ini dapat mempermudah ekosistem ketenagakerjaan indonesia dan menin...",['No_Problem_Detected'],[],0
1202,5,"aplikasi yang sangat berguna , banyak lowongan pekerjaan, sangat membantu untuk mencari lowongan pek...",['No_Problem_Detected'],[],0
1203,5,"terimakasih, aplikasinya sangat membantu dalam mencari lowongan pekerjaan, dan banyak lowongan peker...",['No_Problem_Detected'],[],0
1204,5,"aplikasinya sangat mudah untuk diakses, informatif seputar pekerjaan dan sangat membantu bagi ara pe...",['No_Problem_Detected'],[],0
1205,5,"aplikasinya ngebantu banget untuk mencari info lowongan pekerjaan. makasih siapkerja , nsudah memuda...",['No_Problem_Detected'],[],0
1206,5,"aplikasinya bagus sangat membantu untuk yang sedang mencari pekerjaan, lowongan yang tersedia juga b...",['No_Problem_Detected'],[],0
1207,5,aplikasi siap kerja sangat bermanfaat sekali untuk saya yang baru memulai dan ingin mencari pekerjaa...,['No_Problem_Detected'],[],0
1208,5,"aplikasi ini membantu banget buat nyari kerja. aku yg belum dapat kerja, langsung dapat banyak info ...",['No_Problem_Detected'],[],0
1209,5,alhamdullilah nemu aplikasi siapkerja. sangat bermanfaat membantu buat aku yang belum punya pekerjaa...,['No_Problem_Detected'],[],0
1210,5,"aplikasinya cukup bagus, berbagai fitur pelatihan guna mempermudah pemahaman sebelum memasuki dunia ...",['No_Problem_Detected'],[],0
1211,5,"aplikasinya bagus, membantu bgt buat aku yang laginyari kerja sesuai kriteria, udh banyak juga lowon...",['No_Problem_Detected'],[],0
1212,5,"aplikasi sangat membantu sekali bagi yang belum mendapatkan pekerjaan, banyak sekali info lowongan p...",['No_Problem_Detected'],[],0
1213,5,"terimakasih banget sama aplikasi siap kerja, aplikasinya bikin aku jadi mudah buat cari kerja, seman...",['No_Problem_Detected'],[],0
1214,5,"aplikasi yang sangat bermanfaat bagi kita yang membutuhkan lowongan kerja, sangat memudahkan untuk m...",['No_Problem_Detected'],[],0
1215,5,"nyari lowongan kerja memang sulit, tapi dengan siapkerja ga perlu pusing lagi. ada banyak lowongan y...",['No_Problem_Detected'],[],0
1216,5,"aplikasinya membantu bangett, pas buat aku yg lagi cari lowongan pekerjaan. makasih siapkerja buat i...",['No_Problem_Detected'],[],0
1217,5,"siapkerja ngebantu banget buat aku mahasiswi dapetin informasi pekerjaan, magang dan nyediain pelati...",['No_Problem_Detected'],[],0
1218,5,terimakasih info lowongannya.. membantu banget untuk aku yang belum punya kerjaan..pokoknya terthe b...,['No_Problem_Detected'],[],0
1219,5,aplikasinya sangat bagus bisa memadai orang orang buat mencari pekerjaan dengan fitur2 yang sangatt ...,['No_Problem_Detected'],[],0
1220,5,"aplikasinya sangat bermanfaat, memberi informasi lowongan pekerjaan, berguna sekali untuk yang sedan...",['No_Problem_Detected'],[],0
1221,5,"apknya bagus bagett, bisa cari"" lowongan kerja buat yang pengangguran dan banyak banget manfaatnya y...",['No_Problem_Detected'],[],0
1222,5,"aplikasi nya bagus, ada fasilitas yg support buat orang' yg lagi cari lowongan kerja, ad pelatihan k...",['No_Problem_Detected'],[],0
1223,5,"aplikasi yang mambantu banget buat aku yang baru lulus dan lagi nyari kerja, banyak banget info yang...",['No_Problem_Detected'],[],0
1224,5,"sangat bermanfaat untuk para pencari kerja, dan bagus,mudah ngeklaim pekerjaan",['No_Problem_Detected'],[],0
1225,5,tolong dong admin verivikasi status cpmi saya sudah lengkap supaya saya bisa melamar kerja ke luar n...,['No_Problem_Detected'],[],0
1226,5,aplikasinya membantu banget buat yg belum punya kerjaan. lowongan kerjanya juga banyak. makasih siap...,['No_Problem_Detected'],[],0
1227,5,"aplikasi nya sangat membantu, dan banyak pelatihan, lowongan pekerjaan. terimakasih siapkerja👍",['No_Problem_Detected'],[],0
1228,5,"dari sudut pandang penyelenggara pelatihan, sebaiknya ditambah fitur chat dengan pendaftar, supaya k...",['No_Problem_Detected'],[],0
1229,5,"bukan sekedar nyariin kerja, but sekalian ngasah skill lebih bagus lagi, good app good work 👍 terima...",['No_Problem_Detected'],[],0
1230,5,"aplikasinya keren banget!!!! sangat membantu untuk para pencari kerja, terlebih fitur yang disediaka...",['No_Problem_Detected'],[],0
1231,5,"aplikasinya membantu sekali untuk mencari lowongan pekerjaan, pelatihan untuk meningkatkan kemampuan...",['No_Problem_Detected'],[],0
1232,5,saya lupa password akun kemnaker dan saat reset password tidak mendapatkan kode otp karena nomor tel...,['No_Problem_Detected'],[],0
1233,5,👍👍👍👍👍👌 no comen menurut saya aplikasi ini bagus sangat membantu mencari lowongan pekerjaan.terus tin...,['No_Problem_Detected'],[],0
1234,5,"apk untuk pencari kerja yg rekomended bgt sih, sangat mudah dijangkau dan banyak informasi lowongann...",['No_Problem_Detected'],[],0
1235,5,"terima kasih siapkerja, aplikasinya sangat membantu saya yg baru lulus kuliah, penggunaannya juga mu...",['No_Problem_Detected'],[],0
1236,5,usefull banget! bisa memudahkan kita mencari lowongan yang tepat dan menambah skill kita.,['No_Problem_Detected'],[],0
1237,5,"aplikasi nya keren, pelatihan-pelatihan yang tersedia juga sangat membantu.",['No_Problem_Detected'],[],0
1238,5,"aplikasinya keren, dengan tampilan simpel dan memudahkan kita untuk mencari pekerjaan",['No_Problem_Detected'],[],0
1239,5,"terimakasih siap kerja , info lowongannya sangat membantu ,, dapat kerja dari apk ini nihh .",['No_Problem_Detected'],[],0
1240,5,"aplikasi ini berguna banget buat aku yang belum dapet kerja dan mau cari kerja, terimakasih siapkerj...",['No_Problem_Detected'],[],0
1241,5,"aplikasinya bagus banget, fitur lengkap, tersedia pelatihan kerja, lowongan kerja, magang dsb,terima...",['No_Problem_Detected'],[],0
1242,5,"aplikasi nya bagus banget, berguna banget buat yg nyari kerja sama fitur fiturnya ckp lengkap",['No_Problem_Detected'],[],0
1243,5,aplikasi nya bagus cocok untuk yg baru lulus frash graduate untuk mencari pengalaman,['No_Problem_Detected'],[],0
1244,5,"suka banget sama apk nya karena membantu banget buat aku yang lagi nyari kerjaan, apalagi aku fresh ...",['No_Problem_Detected'],[],0
1245,5,"aplikasi yang ngebantu untuk yang butuh lowongan kerja sihh ini, bagus dan ngebantu banget",['No_Problem_Detected'],[],0
1246,5,aplikasi sangat membantu buat upgrade skill dan mencari lowongan pekerjaan menjadi mudah,['No_Problem_Detected'],[],0
1247,5,"terima kasih info lowkernya, sangat membantu sekali untuk para jobseeker, makasih siap kerja, mudah ...",['No_Problem_Detected'],[],0
1248,5,karena aplikasi siapkerja memudahkan sy mencari pekerjaan.. sekarang sudah dapat pekerjaan sesuai bi...,['No_Problem_Detected'],[],0
1249,5,aplikasinya sangat bermanfat dan membantu terutama utk yg belum punya kerjaan. terimakasih jg utk in...,['No_Problem_Detected'],[],0
1250,5,"aplikasinya sangat bermanfaat untuk mencari pekerjaan, fitur-fiturnya juga mudah diakses🤩",['No_Problem_Detected'],[],0
1251,5,aplikasi yang sangat baguss dan sangat sangat membantuu serta sudah jelas terpampang semua dalam apl...,['No_Problem_Detected'],[],0
1252,5,"akhirnya ada juga aplikasi yang bagus buat nyari info lowongan kerja, makasih banget lhoo siapkerja ...",['No_Problem_Detected'],[],0
1253,5,"aplikasi sangat membantu , terimakasih info lowongan kerja nya. mudah dan gampang cari info loker .",['No_Problem_Detected'],[],0
1254,5,aplikasi yang mempermudah orang-orang untuk mencari lowongan pekerjaan. semoga dapat terus dikembang...,['No_Problem_Detected'],[],0
1255,5,"aplikasi ini sangat bagus dan bermanfaat bagi para pencari lowongan kerja, serta harus dikembangkan ...",['No_Problem_Detected'],[],0
1256,5,aplikasi yang membantu banget buat aku yang belum dapet kerja.. semoga setelah ini bisa dapet pekerj...,['No_Problem_Detected'],[],0
1257,5,"aplikasi ini membantu banget buat aku yang lagi nyari kerjaan, makasih bgt info lowongannya. thanks ...",['No_Problem_Detected'],[],0
1258,5,aplikasinya sangat membantu dan mempermudah saya dalam mencari pekerjaan. makasih siapkerja,['No_Problem_Detected'],[],0
1259,5,terimah kasih untuk info lowongan kerja nya dan ini sangat membantu sekali untuk saya yang sedang me...,['No_Problem_Detected'],[],0
1260,5,aplikasi yang bagus buat cari lowongan kerja. pokoknya membantu banget buat dapet kerjaan.,['No_Problem_Detected'],[],0
1261,5,"aplikasinya sangat membantu saya untuk mencati lowongan pekerjaan, mudah juga penggunaannya",['No_Problem_Detected'],[],0
1262,5,aplikasinya sangat membantu saya sekali dalam mencari referensi kerja. semoga kinerja aplikasi ini d...,['No_Problem_Detected'],[],0
1263,5,"lowongan pekerjaan yang diberikan sangat variatif dan informatif sekali, terima kasih..",['No_Problem_Detected'],[],0
1264,5,"aplikasi yang sangat membantu untuk para pekerja, semoga aplikasi ini dapat selalu di upgrade menjad...",['No_Problem_Detected'],[],0
1265,5,"aplikasinya membantu banget, ada info lowongan kerja membantu banget untuk aku yang belum punya kerj...",['No_Problem_Detected'],[],0
1266,5,aplikasi ini sangat bermanfaat karena memberikan program pelatihan pra kerja gratis dari pemerintah ...,['No_Problem_Detected'],[],0
1267,5,aplikasinya sangat membantu sekali untuk mencari lowongan kerja buat saya yang belum mendapatkan pek...,['No_Problem_Detected'],[],0
1268,5,"aplikasinya sangat membantu dan fiturnya sangat berguna dengan baik, terimakasih siapkerja",['No_Problem_Detected'],[],0
1269,5,"membantu untuk yg sedang mencari perkerjaan, semoga aplikasi nya makin berkembang 🥰👍",['No_Problem_Detected'],[],0
1270,5,"membantu banget buat cari kerja, bisa nambah skill dan banyak bimbingan.. makasih banyak",['No_Problem_Detected'],[],0
1271,5,"aplikasi ini membantu banget bagi yang pra kerja, terkoneksi banyak pelatihan gratis dari pemerintah...",['No_Problem_Detected'],[],0
1272,5,aplikasi yang membantu untuk meningkatkan skill dan membantu juga mencari pekerjaan the bestt,['No_Problem_Detected'],[],0
1273,5,aplikasi ini sangat membantu untuk membuka lapangan kerja khusus nya dibidang tehnisi pendingin ( ac...,['No_Problem_Detected'],[],0
1274,5,"aplikasi yang sangat membantu aku banget untuk cari kerja, banyak berbagai info loker, terimakasih s...",['No_Problem_Detected'],[],0
1275,5,"bagus aplikasinyaa, informasi nya jelas lengkap dan mudah.",['No_Problem_Detected'],[],0
1276,5,"aplikasi siap kerja sangat memudahkan saya untuk mencari pekerjaan, recomended deh.",['No_Problem_Detected'],[],0
1277,5,"ini aplikasi sangat menbantu mencari pekerjaan, terimakasih info lowongannya.",['No_Problem_Detected'],[],0
1278,5,aplikasi ini sangat bagus karena memberi latihan pelayanan agar kita bisa siap. kerja,['No_Problem_Detected'],[],0
1279,5,aplikasinya sangat bagus membantu kita untuk menemukan pekerjaan yang kita mau dan siap untuk kerja,['No_Problem_Detected'],[],0
1280,5,jujur ini sangat membantu aku yang belum punya pekerjaan untuk bisa cari lowongan pekerjaan. rate dr...,['No_Problem_Detected'],[],0
1281,5,aplikasi yang sangat bermanfaat dan ngebantu banget buat job seekers kaya aku. terimakasii siapkerja,['No_Problem_Detected'],[],0
1282,5,"aplikasi ini sangat bagus, fiturnya juga keren banget jadi bisa memberikan informasi tentang pekerja...",['No_Problem_Detected'],[],0
1283,5,sangat membantu mencari pekerjaan. sesuai skil untuk pekerjaan maju terus siap kerja,['No_Problem_Detected'],[],0
1284,5,"banyak informasi lowongan kerja, bisa pilih sesuai passion. pokoknya membantu banget deh",['No_Problem_Detected'],[],0
1285,5,"aplikasinya sangat membantu dan informatif sekali, cocok untuk menambah pengetahuan",['No_Problem_Detected'],[],0
1286,5,"aplikasi nya bagus, sangat informatif, dan sangat direkomendasikan deh bagi yang ingin mencari kerja",['No_Problem_Detected'],[],0
1287,5,"ui ux nya kerenn, dan aplikasi ini ngebantu banget buat saya mencari lowongan kerja, mantap deh ✨",['No_Problem_Detected'],[],0
1288,5,"terima kasih siapkerja, aplikasi nya membantu sekali untuk mencari lowongan kerja",['No_Problem_Detected'],[],0
1289,5,"terimakasih siap kerja ,dengan adanya apk ini ,membantu saya mempermudah mencari lowongan kerja",['No_Problem_Detected'],[],0
1290,5,terima kasih aplikasi siapkerja. sangat membantu saya mendapatkan info lowongan pekerjaan. semoga ke...,['No_Problem_Detected'],[],0
1291,5,"aplikasinya keren bngett, bagus bget buat temen-temen yg bingung buat cari pekerjaan",['No_Problem_Detected'],[],0
1292,5,"sebagai aku yang fresh graduate, apk nya sangat membantu sekali buat aku ya ng nyari kerja. terima k...",['No_Problem_Detected'],[],0
1293,5,"aplikasinya sangat bagus, memberikan layanan yang sangat berguna untuk para pencari kerja",['No_Problem_Detected'],[],0
1294,5,"membantu sekali untuk para fresh graduated seperti aku yang belum punya kerjaan, terimakasih info lo...",['No_Problem_Detected'],[],0
1295,5,aplikasi ini sangat membantu saya dalam mencari lowongan pekerjaan. terima kasih siap kerjaaaa.,['No_Problem_Detected'],[],0
1296,5,aplikasi siapkerja sangat membantu fresh graduate untuk mencari pekerjaan,['No_Problem_Detected'],[],0
1297,5,"aplikasinya sangat membantu saya untuk menerima info lowongan kerja, makasih siappp kerjaa",['No_Problem_Detected'],[],0
1298,5,makasi banget ama aplikasi sekarang jauh lebih mudah cari lowongan pekerjan goog job aplikasinya,['No_Problem_Detected'],[],0
1299,5,sangat membantu untuk mencari pekerjaan dan pelatihan kerja yang sesuai,['No_Problem_Detected'],[],0
1300,5,"membantu para pencari pekerjaan dengan mudah dan simpel, semoga semakin banyak lowongan kerja bagi t...",['No_Problem_Detected'],[],0
1301,5,"terima kasih siapkerja, aplikasi sangat membantu untuk mencari lowongan 👍",['No_Problem_Detected'],[],0
1302,5,"sangat membantu dalam dunia kerja, bermanfaat, semoga bis terus berkembang",['No_Problem_Detected'],[],0
1303,5,aplikasinya bermanfaat👍🏻 fiturnya sangat membantu bagi para ketenagakerjaan,['No_Problem_Detected'],[],0
1304,5,"aplikasinya bermanfaat, membantu banget untuk aku yang lagi nyari pekerjaan, makasih siapkerja🥰",['No_Problem_Detected'],[],0
1305,5,"makasih banget buat info lowongannya, sangat bermanfaat dan ngebantu aku yang masih nyari kerja.",['No_Problem_Detected'],[],0
1306,5,"aplikasi bagus bgttt, bener bener recomended untuk pejuang loker kaya ak, pokoknya bintang 100 untuk...",['No_Problem_Detected'],[],0
1307,5,aplikasi ini ngebantu banget buat aku yang lagi nyari kerja karena ada banyak info lowongan pekerjaa...,['No_Problem_Detected'],[],0
1308,5,"applikasinya bagus banget, banyak info lowongan kerja disini.",['No_Problem_Detected'],[],0
1309,5,sangat berguna untuk pencari kerja yang tau informasi pelatihan dan kerja,['No_Problem_Detected'],[],0
1310,5,aplikasi yang sangat bermanfaat untuk mencari pekerjaan. memudahkan masyarakat mengakses pekerjaan y...,['No_Problem_Detected'],[],0
1311,5,"terimakasih sudah menyediakan aplikasi ini, membantu banget untuk aku yang belum punya kerjaan. mant...",['No_Problem_Detected'],[],0
1312,5,"disini banyak banget lowongan kerjanya, ngebantu banget sih buat aku yang beberapa bulan ini masih n...",['No_Problem_Detected'],[],0
1313,5,aplikasi nya sangat membantu untuk menemukan informasi pekerjaan. terus kembangkan untuk menuju indo...,['No_Problem_Detected'],[],0
1314,5,"aplikasi nya simpel, banyak sekali lowongan yang tersedia",['No_Problem_Detected'],[],0
1315,5,aplikasi nya bagus banget dan setelah kita lulus langsung dapat kerja,['No_Problem_Detected'],[],0
1316,5,aplikasi ini sangat membantu bagi para pencari kerja. banyak fitur yang sangat membantu dan mudah di...,['No_Problem_Detected'],[],0
1317,5,"dengan tampilan yang mudah sekali untuk dipahami, aplikasi ini sangat membantu saya",['No_Problem_Detected'],[],0
1318,5,kalau jaringannya bagus langsung bisa ...tetapi kalau sedang susah jaringan bagaimana?,['No_Problem_Detected'],[],0
1319,5,aplikasi ini sangat bermanfaat sekali bagi saya dn terutama bagi yang ingin mencari kerja,['No_Problem_Detected'],[],0
1320,5,"terima kasih buat yang udah bkin aplikasi ini, karena membantu banget buat yang lagi nyari sampai da...",['No_Problem_Detected'],[],0
1321,5,terima kasih siapkerja.. sangat membantu sekali buat saya yang masih jobless nemuin kerjaan yg sesua...,['No_Problem_Detected'],[],0
1322,5,aplikasinya sangat membantu untuk yang sedang mencari pekerjaan.,['No_Problem_Detected'],[],0
1323,5,aplikasi ini sangat membantu dalam mencari pekerjaan. penggunaannya juga sangat mudah,['No_Problem_Detected'],[],0
